sqlite> 
sqlite> 
sqlite> .mode column
sqlite> select * from cadastro_pessoas;
nomeTeste   123         124Teste  
sqlite> 
sqlite> 
sqlite> .headers on
sqlite> select * from cadastro_pessoas;
nome        matricula   id_card   
----------  ----------  ----------
nomeTeste   123         124Teste  
sqlite> 
sqlite> .tables
cadastro_pessoas  registros       
sqlite> select * registros
   ...> ;
Error: near "registros": syntax error
sqlite> select * from registros;
momento                     id_card     autorizado
--------------------------  ----------  ----------
2017-05-07 15:30:56.880878  123456      0         
2017-05-07 15:31:08.329687  123456      0         
2017-05-07 16:20:33.902524  123456      0         
2017-05-07 16:26:26.166701  123456      0         
2017-05-07 16:29:14.858734  123456      0         
2017-05-07 16:29:23.552954  123456      0         
2017-05-07 16:33:38.149811  123456      0         
2017-05-07 16:46:57.459251  123456      0         
2017-05-07 17:01:02.568537  123456      0         
2017-05-07 17:03:50.737854  123456      0         
2017-05-07 17:04:35.247203  123456      0         
2017-05-07 17:05:03.807266  123456      0         
2017-05-07 17:08:50.208321  123456      0         
2017-05-07 17:10:29.276747  123456      0         
2017-05-07 17:11:21.480227  123456      1         
2017-05-11 20:51:12.385119  123456      1         
2017-05-11 21:06:38.147301  123456      1         
sqlite> select * from registros;
momento                     id_card     autorizado
--------------------------  ----------  ----------
2017-05-07 15:30:56.880878  123456      0         
2017-05-07 15:31:08.329687  123456      0         
2017-05-07 16:20:33.902524  123456      0         
2017-05-07 16:26:26.166701  123456      0         
2017-05-07 16:29:14.858734  123456      0         
2017-05-07 16:29:23.552954  123456      0         
2017-05-07 16:33:38.149811  123456      0         
2017-05-07 16:46:57.459251  123456      0         
2017-05-07 17:01:02.568537  123456      0         
2017-05-07 17:03:50.737854  123456      0         
2017-05-07 17:04:35.247203  123456      0         
2017-05-07 17:05:03.807266  123456      0         
2017-05-07 17:08:50.208321  123456      0         
2017-05-07 17:10:29.276747  123456      0         
2017-05-07 17:11:21.480227  123456      1         
2017-05-11 20:51:12.385119  123456      1         
2017-05-11 21:06:38.147301  123456      1         
2017-05-11 22:07:11.162360  123456      1         
sqlite> delete from registros;
sqlite> select * from registros;
sqlite> delete from registros;
sqlite> select * from registros;
momento                     id_card     autorizado
--------------------------  ----------  ----------
2017-05-11 22:07:57.646440  123456      1         
sqlite> select * from registros;
momento                     id_card     autorizado
--------------------------  ----------  ----------
2017-05-11 22:07:57.646440  123456      1         
2017-05-11 22:13:02.289212  123456      1         
sqlite> select * from registros;
momento                     id_card     autorizado
--------------------------  ----------  ----------
2017-05-11 22:07:57.646440  123456      1         
2017-05-11 22:13:02.289212  123456      1         
2017-05-11 22:57:06.466744  123456      1         
sqlite> 